{
  "$schema": "https://json-schema.org/draft/2020-12/schema",
  "$id": "https://aiba.dev/schema/v0alpha1/lock.schema.json",
  "title": "AIBA Project Lock",
  "type": "object",
  "additionalProperties": false,
  "required": ["apiVersion", "kind", "generatedAt", "capabilities"],
  "properties": {
    "apiVersion": { "const": "aiba.dev/v0alpha1" },
    "kind": { "const": "Lock" },
    "generatedAt": { "type": "string", "format": "date-time" },
    "capabilities": {
      "type": "array",
      "items": {
        "type": "object",
        "additionalProperties": false,
        "required": ["id", "version", "manifestSha256"],
        "properties": {
          "id": { "type": "string", "pattern": "^[a-z][a-z0-9-]{1,62}$" },
          "version": { "type": "string", "pattern": "^(0|[1-9][0-9]*)\\.(0|[1-9][0-9]*)\\.(0|[1-9][0-9]*)(?:-[0-9A-Za-z.-]+)?$" },
          "manifestSha256": { "type": "string", "pattern": "^[a-f0-9]{64}$" },
          "recipe": {
            "type": "object",
            "additionalProperties": false,
            "required": ["id", "sha256"],
            "properties": {
              "id": { "type": "string", "pattern": "^[a-z][a-z0-9-]{1,62}$" },
              "sha256": { "type": "string", "pattern": "^[a-f0-9]{64}$" }
            }
          }
        }
      }
    }
  }
}
